{
  "$schema": "../config.schema.json",
  "model": { "path": "noop.onnx" },
  "input": { "type": "image", "source": "examples/images/sample.png" },
  "preprocessing": {
    "resize": {
      "apply": true,
      "imageSize": [256, 256],
      "keepAspectRatio": true
    },
    "format": { "dataType": "float32", "channels": 3, "channelOrder": "rgb" },
    "normalize": {
      "apply": true,
      "mean": [0.5, 0.5, 0.5],
      "std": [0.5, 0.5, 0.5]
    }
  },
  "postprocessing": {
    "denormalize": { "apply": true, "scale": 255, "dtype": "uint8" },
    "colorMap": { "apply": true, "mode": "viridis", "channel": 0 },
    "resizeTo": "input"
  },
  "output": {
    "save": { "apply": true, "path": "examples/outputs", "format": "png" }
  }
}
