{
  "$schema": "../config.schema.json",
  "model": { "path": "noop.onnx" },
  "input": { "type": "image", "source": "./examples/images/sample.png" },
  "preprocessing": {
    "format": { "dataType": "float32", "channels": 3, "channelOrder": "rgb" },
    "normalize": { "apply": false }
  },
  "postprocessing": { "denormalize": { "apply": true, "scale": 255 } },
  "output": {
    "save": { "apply": true, "path": "./examples/outputs", "format": "png" },
    "saveRaw": {
      "apply": true,
      "format": "npz",
      "path": "./examples/outputs/raw"
    }
  }
}
